{
  "id": "wimbledon",
  "name": "温布尔登网球锦标赛",
  "category": "sports",
  "name_en": "The Championships, Wimbledon",
  "subcategory": "网球",
  "description": "温布尔登网球锦标赛资格赛、正赛和单打决赛日历。",
  "icon": "/logos/wimbledon.svg",
  "tags": [
    "网球",
    "温网",
    "Wimbledon"
  ],
  "tags_en": [
    "Tennis",
    "Wimbledon"
  ],
  "maintainer": "official",
  "source_url": "https://www.wimbledon.com",
  "subscriber_count": 9725,
  "rating": 4.8,
  "rating_count": 83,
  "events": [
    {
      "id": "wimbledon-2026-qualifying",
      "name": "2026 温布尔登网球锦标赛资格赛",
      "name_en": "2026 The Championships, Wimbledon Qualifying",
      "date": "2026-06-22",
      "end_date": "2026-06-25",
      "timezone": "Europe/London",
      "type": "range",
      "year": 2026,
      "description": "温布尔登网球锦标赛资格赛窗口。",
      "description_en": "The Championships, Wimbledon qualifying window.",
      "url": "https://www.wimbledon.com",
      "status": "completed",
      "last_verified": "2026-07-13",
      "verified_by": "official",
      "details": {
        "英文名": "The Championships, Wimbledon",
        "赛事级别": "网球四大满贯"
      }
    },
    {
      "id": "wimbledon-2026-main-draw",
      "name": "2026 温布尔登网球锦标赛正赛",
      "name_en": "2026 The Championships, Wimbledon Main Draw",
      "date": "2026-06-29",
      "end_date": "2026-07-12",
      "timezone": "Europe/London",
      "type": "range",
      "year": 2026,
      "description": "温布尔登网球锦标赛正赛日期。",
      "description_en": "The Championships, Wimbledon main draw dates.",
      "url": "https://www.wimbledon.com",
      "status": "completed",
      "last_verified": "2026-07-13",
      "verified_by": "official",
      "details": {
        "英文名": "The Championships, Wimbledon",
        "赛事级别": "网球四大满贯"
      }
    },
    {
      "id": "wimbledon-2026-women-final",
      "name": "2026 温布尔登网球锦标赛女单决赛",
      "name_en": "2026 The Championships, Wimbledon Women's Final",
      "date": "2026-07-11",
      "timezone": "Europe/London",
      "type": "event",
      "year": 2026,
      "description": "温布尔登网球锦标赛女单决赛日，具体开赛时间以赛事日程为准。",
      "description_en": "The Championships, Wimbledon women's singles final day; exact start time per the tournament schedule.",
      "url": "https://www.wimbledon.com",
      "status": "completed",
      "last_verified": "2026-07-13",
      "verified_by": "official"
    },
    {
      "id": "wimbledon-2026-men-final",
      "name": "2026 温布尔登网球锦标赛男单决赛",
      "name_en": "2026 The Championships, Wimbledon Men's Final",
      "date": "2026-07-12",
      "timezone": "Europe/London",
      "type": "event",
      "year": 2026,
      "description": "温布尔登网球锦标赛男单决赛日，具体开赛时间以赛事日程为准。",
      "description_en": "The Championships, Wimbledon men's singles final day; exact start time per the tournament schedule.",
      "url": "https://www.wimbledon.com",
      "status": "completed",
      "last_verified": "2026-07-13",
      "verified_by": "official"
    }
  ],
  "last_updated": "2026-07-13",
  "subcategory_en": "Tennis",
  "cycle_kind": "year"
}
