{
  "id": "teacher-qualification",
  "name": "教师资格考试",
  "category": "exam",
  "name_en": "National Teacher Qualification Exam",
  "subcategory": "职业资格",
  "exam_classification": {
    "audiences": [
      "student",
      "professional"
    ],
    "tracks": [
      "education"
    ]
  },
  "description": "中小学教师资格考试笔试、面试、成绩查询和认定相关关键时间节点。",
  "icon": "clipboard-check",
  "tags": [
    "教资",
    "教师资格",
    "笔试",
    "面试"
  ],
  "tags_en": [
    "Teacher Qualification",
    "Exam"
  ],
  "maintainer": "community",
  "source_url": "https://ntce.neea.edu.cn",
  "subscriber_count": 35400,
  "rating": 4.7,
  "rating_count": 390,
  "events": [
    {
      "id": "teacher-qualification-2026-h1-written-register",
      "name": "2026上半年教资笔试报名",
      "name_en": "2026 H1 Teacher Qualification Exam Written Exam Registration",
      "date": "2026-01-09",
      "end_date": "2026-01-12",
      "timezone": "Asia/Shanghai",
      "type": "range",
      "year": 2026,
      "description": "中小学教师资格考试上半年笔试报名。",
      "description_en": "H1 written exam registration for the national teacher qualification exam.",
      "url": "https://ntce.neea.edu.cn",
      "status": "completed",
      "last_verified": "2026-07-07",
      "verified_by": "community"
    },
    {
      "id": "teacher-qualification-2026-h1-written-exam",
      "name": "2026上半年教资笔试",
      "name_en": "2026 H1 Teacher Qualification Exam Written Exam",
      "date": "2026-03-07",
      "timezone": "Asia/Shanghai",
      "type": "event",
      "year": 2026,
      "description": "中小学教师资格考试上半年笔试。",
      "description_en": "H1 written exam of the national teacher qualification exam.",
      "url": "https://ntce.neea.edu.cn",
      "status": "completed",
      "last_verified": "2026-07-07",
      "verified_by": "community"
    },
    {
      "id": "teacher-qualification-2026-h1-written-results",
      "name": "2026上半年教资笔试成绩",
      "name_en": "2026 H1 Teacher Qualification Exam Written Exam Results Release",
      "date": "2026-04-10",
      "timezone": "Asia/Shanghai",
      "type": "announcement",
      "year": 2026,
      "description": "上半年笔试成绩查询开放。",
      "description_en": "H1 written exam results open for query.",
      "url": "https://ntce.neea.edu.cn",
      "status": "completed",
      "last_verified": "2026-07-07",
      "verified_by": "community"
    },
    {
      "id": "teacher-qualification-2026-h1-interview-register",
      "name": "2026上半年教资面试报名",
      "name_en": "2026 H1 Teacher Qualification Exam Interview Registration",
      "date": "2026-04-17",
      "end_date": "2026-04-20",
      "timezone": "Asia/Shanghai",
      "type": "range",
      "year": 2026,
      "description": "中小学教师资格考试上半年面试报名。",
      "description_en": "H1 interview registration for the national teacher qualification exam.",
      "url": "https://ntce.neea.edu.cn",
      "status": "completed",
      "last_verified": "2026-07-07",
      "verified_by": "community"
    },
    {
      "id": "teacher-qualification-2026-h1-interview",
      "name": "2026上半年教资面试",
      "name_en": "2026 H1 Teacher Qualification Exam Interview",
      "date": "2026-05-16",
      "end_date": "2026-05-17",
      "timezone": "Asia/Shanghai",
      "type": "range",
      "year": 2026,
      "description": "中小学教师资格考试上半年面试。",
      "description_en": "H1 interview of the national teacher qualification exam.",
      "url": "https://ntce.neea.edu.cn",
      "status": "completed",
      "last_verified": "2026-07-07",
      "verified_by": "community"
    },
    {
      "id": "teacher-qualification-2026-h2-written-register",
      "name": "2026下半年教资笔试报名",
      "name_en": "2026 H2 Teacher Qualification Exam Written Exam Registration",
      "date": "2026-07-03",
      "end_date": "2026-07-06",
      "timezone": "Asia/Shanghai",
      "type": "range",
      "year": 2026,
      "description": "下半年笔试报名，具体以发布信息为准。",
      "description_en": "H2 written exam registration; follow published information.",
      "url": "https://ntce.neea.edu.cn",
      "status": "completed",
      "last_verified": "2026-07-07",
      "verified_by": "community"
    },
    {
      "id": "teacher-qualification-2026-h2-written-exam",
      "name": "2026下半年教资笔试",
      "name_en": "2026 H2 Teacher Qualification Exam Written Exam",
      "date": "2026-09-12",
      "timezone": "Asia/Shanghai",
      "type": "event",
      "year": 2026,
      "description": "下半年笔试，具体以发布信息为准。",
      "description_en": "H2 written exam; follow published information.",
      "url": "https://ntce.neea.edu.cn",
      "status": "planned",
      "last_verified": "2026-07-07",
      "verified_by": "community"
    },
    {
      "id": "teacher-qualification-2026-h2-interview",
      "name": "2026下半年教资面试",
      "name_en": "2026 H2 Teacher Qualification Exam Interview",
      "date": "2026-12-12",
      "end_date": "2026-12-13",
      "timezone": "Asia/Shanghai",
      "type": "range",
      "year": 2026,
      "description": "下半年面试，具体以发布信息为准。",
      "description_en": "H2 interview; follow published information.",
      "url": "https://ntce.neea.edu.cn",
      "status": "planned",
      "last_verified": "2026-07-07",
      "verified_by": "community"
    }
  ],
  "last_updated": "2026-07-07",
  "subcategory_en": "Professional Certification"
}
