{
  "id": "vn-public-holidays",
  "name": "越南公众假期",
  "category": "holidays",
  "name_en": "Vietnam Public Holidays",
  "subcategory": "公众假期",
  "subcategory_en": "Public Holidays",
  "description": "越南政府公布的公众假期安排，包含传统节日和法定假日。",
  "description_en": "Vietnam public holidays, including traditional festivals and national holidays.",
  "icon": "/logos/holiday/official.png",
  "tags": [
    "越南",
    "公众假期",
    "节假日"
  ],
  "tags_en": [
    "Vietnam",
    "Public Holidays"
  ],
  "maintainer": "official",
  "source_url": "https://www.molisa.gov.vn/",
  "subscriber_count": 7000,
  "rating": 4,
  "rating_count": 180,
  "events": [
    {
      "id": "vn-holiday-2025-new-years-day-01-01-public",
      "name": "Tết dương lịch",
      "name_en": "New Year's Day",
      "date": "2025-01-01",
      "end_date": "2025-01-01",
      "timezone": "Asia/Ho_Chi_Minh",
      "type": "event",
      "year": 2025,
      "description": "Tết dương lịch（越南公众假期）",
      "description_en": "New Year's Day (Vietnam Public Holidays)",
      "url": "https://www.molisa.gov.vn/",
      "status": "completed",
      "last_verified": "2026-09-07",
      "verified_by": "auto",
      "details": {
        "假期类型": "Public",
        "固定日期": "否",
        "全国通用": "是"
      }
    },
    {
      "id": "vn-holiday-2025-reunification-day-04-30-public",
      "name": "Ngày Giải phóng miền Nam, thống nhất đất nước",
      "name_en": "Reunification Day",
      "date": "2025-04-30",
      "end_date": "2025-04-30",
      "timezone": "Asia/Ho_Chi_Minh",
      "type": "event",
      "year": 2025,
      "description": "Ngày Giải phóng miền Nam, thống nhất đất nước（越南公众假期）",
      "description_en": "Reunification Day (Vietnam Public Holidays)",
      "url": "https://www.molisa.gov.vn/",
      "status": "completed",
      "last_verified": "2026-09-07",
      "verified_by": "auto",
      "details": {
        "假期类型": "Public",
        "固定日期": "否",
        "全国通用": "是"
      }
    },
    {
      "id": "vn-holiday-2025-labour-day-05-01-public",
      "name": "Ngày Quốc tế lao động",
      "name_en": "Labour Day",
      "date": "2025-05-01",
      "end_date": "2025-05-01",
      "timezone": "Asia/Ho_Chi_Minh",
      "type": "event",
      "year": 2025,
      "description": "Ngày Quốc tế lao động（越南公众假期）",
      "description_en": "Labour Day (Vietnam Public Holidays)",
      "url": "https://www.molisa.gov.vn/",
      "status": "completed",
      "last_verified": "2026-09-07",
      "verified_by": "auto",
      "details": {
        "假期类型": "Public",
        "固定日期": "否",
        "全国通用": "是"
      }
    },
    {
      "id": "vn-holiday-2025-national-day-09-02-public",
      "name": "Quốc khánh",
      "name_en": "National Day",
      "date": "2025-09-02",
      "end_date": "2025-09-02",
      "timezone": "Asia/Ho_Chi_Minh",
      "type": "event",
      "year": 2025,
      "description": "Quốc khánh（越南公众假期）",
      "description_en": "National Day (Vietnam Public Holidays)",
      "url": "https://www.molisa.gov.vn/",
      "status": "completed",
      "last_verified": "2026-09-07",
      "verified_by": "auto",
      "details": {
        "假期类型": "Public",
        "固定日期": "否",
        "全国通用": "是"
      }
    },
    {
      "id": "vn-holiday-2026-new-years-day-01-01-public",
      "name": "Tết dương lịch",
      "name_en": "New Year's Day",
      "date": "2026-01-01",
      "end_date": "2026-01-01",
      "timezone": "Asia/Ho_Chi_Minh",
      "type": "event",
      "year": 2026,
      "description": "Tết dương lịch（越南公众假期）",
      "description_en": "New Year's Day (Vietnam Public Holidays)",
      "url": "https://www.molisa.gov.vn/",
      "status": "completed",
      "last_verified": "2026-09-07",
      "verified_by": "auto",
      "details": {
        "假期类型": "Public",
        "固定日期": "否",
        "全国通用": "是"
      }
    },
    {
      "id": "vn-holiday-2026-reunification-day-04-30-public",
      "name": "Ngày Giải phóng miền Nam, thống nhất đất nước",
      "name_en": "Reunification Day",
      "date": "2026-04-30",
      "end_date": "2026-04-30",
      "timezone": "Asia/Ho_Chi_Minh",
      "type": "event",
      "year": 2026,
      "description": "Ngày Giải phóng miền Nam, thống nhất đất nước（越南公众假期）",
      "description_en": "Reunification Day (Vietnam Public Holidays)",
      "url": "https://www.molisa.gov.vn/",
      "status": "completed",
      "last_verified": "2026-09-07",
      "verified_by": "auto",
      "details": {
        "假期类型": "Public",
        "固定日期": "否",
        "全国通用": "是"
      }
    },
    {
      "id": "vn-holiday-2026-labour-day-05-01-public",
      "name": "Ngày Quốc tế lao động",
      "name_en": "Labour Day",
      "date": "2026-05-01",
      "end_date": "2026-05-01",
      "timezone": "Asia/Ho_Chi_Minh",
      "type": "event",
      "year": 2026,
      "description": "Ngày Quốc tế lao động（越南公众假期）",
      "description_en": "Labour Day (Vietnam Public Holidays)",
      "url": "https://www.molisa.gov.vn/",
      "status": "completed",
      "last_verified": "2026-09-07",
      "verified_by": "auto",
      "details": {
        "假期类型": "Public",
        "固定日期": "否",
        "全国通用": "是"
      }
    },
    {
      "id": "vn-holiday-2026-national-day-09-02-public",
      "name": "Quốc khánh",
      "name_en": "National Day",
      "date": "2026-09-02",
      "end_date": "2026-09-02",
      "timezone": "Asia/Ho_Chi_Minh",
      "type": "event",
      "year": 2026,
      "description": "Quốc khánh（越南公众假期）",
      "description_en": "National Day (Vietnam Public Holidays)",
      "url": "https://www.molisa.gov.vn/",
      "status": "completed",
      "last_verified": "2026-09-07",
      "verified_by": "auto",
      "details": {
        "假期类型": "Public",
        "固定日期": "否",
        "全国通用": "是"
      }
    },
    {
      "id": "vn-holiday-2027-new-years-day-01-01-public",
      "name": "Tết dương lịch",
      "name_en": "New Year's Day",
      "date": "2027-01-01",
      "end_date": "2027-01-01",
      "timezone": "Asia/Ho_Chi_Minh",
      "type": "event",
      "year": 2027,
      "description": "Tết dương lịch（越南公众假期）",
      "description_en": "New Year's Day (Vietnam Public Holidays)",
      "url": "https://www.molisa.gov.vn/",
      "status": "confirmed",
      "last_verified": "2026-09-07",
      "verified_by": "auto",
      "details": {
        "假期类型": "Public",
        "固定日期": "否",
        "全国通用": "是"
      }
    },
    {
      "id": "vn-holiday-2027-reunification-day-04-30-public",
      "name": "Ngày Giải phóng miền Nam, thống nhất đất nước",
      "name_en": "Reunification Day",
      "date": "2027-04-30",
      "end_date": "2027-04-30",
      "timezone": "Asia/Ho_Chi_Minh",
      "type": "event",
      "year": 2027,
      "description": "Ngày Giải phóng miền Nam, thống nhất đất nước（越南公众假期）",
      "description_en": "Reunification Day (Vietnam Public Holidays)",
      "url": "https://www.molisa.gov.vn/",
      "status": "confirmed",
      "last_verified": "2026-09-07",
      "verified_by": "auto",
      "details": {
        "假期类型": "Public",
        "固定日期": "否",
        "全国通用": "是"
      }
    },
    {
      "id": "vn-holiday-2027-labour-day-05-01-public",
      "name": "Ngày Quốc tế lao động",
      "name_en": "Labour Day",
      "date": "2027-05-01",
      "end_date": "2027-05-01",
      "timezone": "Asia/Ho_Chi_Minh",
      "type": "event",
      "year": 2027,
      "description": "Ngày Quốc tế lao động（越南公众假期）",
      "description_en": "Labour Day (Vietnam Public Holidays)",
      "url": "https://www.molisa.gov.vn/",
      "status": "confirmed",
      "last_verified": "2026-09-07",
      "verified_by": "auto",
      "details": {
        "假期类型": "Public",
        "固定日期": "否",
        "全国通用": "是"
      }
    },
    {
      "id": "vn-holiday-2027-national-day-09-02-public",
      "name": "Quốc khánh",
      "name_en": "National Day",
      "date": "2027-09-02",
      "end_date": "2027-09-02",
      "timezone": "Asia/Ho_Chi_Minh",
      "type": "event",
      "year": 2027,
      "description": "Quốc khánh（越南公众假期）",
      "description_en": "National Day (Vietnam Public Holidays)",
      "url": "https://www.molisa.gov.vn/",
      "status": "confirmed",
      "last_verified": "2026-09-07",
      "verified_by": "auto",
      "details": {
        "假期类型": "Public",
        "固定日期": "否",
        "全国通用": "是"
      }
    }
  ],
  "last_updated": "2026-09-07"
}
