{
  "id": "cn-public-holidays",
  "name": "中国大陆节假日",
  "category": "holidays",
  "name_en": "Mainland China Public Holidays",
  "subcategory": "公众假期",
  "description": "中国大陆法定节假日安排，自动同步国务院发布的放假通知，包含调休补班信息。",
  "icon": "calendar-days",
  "tags": [
    "节假日",
    "放假",
    "调休",
    "中国"
  ],
  "tags_en": [
    "Holidays",
    "Days Off",
    "Make-up Days",
    "China"
  ],
  "maintainer": "official",
  "source_url": "https://www.gov.cn/",
  "subscriber_count": 45200,
  "rating": 4.6,
  "rating_count": 1200,
  "last_updated": "2026-10-12",
  "events": [
    {
      "id": "cn-holiday-2025-new-year",
      "name": "元旦",
      "name_en": "2025 New Year's Day",
      "date": "2025-01-01",
      "end_date": "2025-01-01",
      "timezone": "Asia/Shanghai",
      "type": "range",
      "year": 2025,
      "description": "放假共 1 天",
      "description_en": "1-day public holiday in mainland China",
      "url": "https://www.gov.cn/",
      "status": "completed",
      "last_verified": "2026-10-12",
      "verified_by": "auto"
    },
    {
      "id": "cn-holiday-2025-spring-festival",
      "name": "春节",
      "name_en": "2025 Spring Festival",
      "date": "2025-01-28",
      "end_date": "2025-02-04",
      "timezone": "Asia/Shanghai",
      "type": "range",
      "year": 2025,
      "description": "放假共 8 天",
      "description_en": "8-day public holiday in mainland China",
      "url": "https://www.gov.cn/",
      "status": "completed",
      "last_verified": "2026-10-12",
      "verified_by": "auto",
      "makeup_workdays": [
        "2025-01-26",
        "2025-02-08"
      ]
    },
    {
      "id": "cn-holiday-2025-qingming",
      "name": "清明节",
      "name_en": "2025 Qingming Festival",
      "date": "2025-04-04",
      "end_date": "2025-04-06",
      "timezone": "Asia/Shanghai",
      "type": "range",
      "year": 2025,
      "description": "放假共 3 天",
      "description_en": "3-day public holiday in mainland China",
      "url": "https://www.gov.cn/",
      "status": "completed",
      "last_verified": "2026-10-12",
      "verified_by": "auto"
    },
    {
      "id": "cn-holiday-2025-labor-day",
      "name": "劳动节",
      "name_en": "2025 Labour Day",
      "date": "2025-05-01",
      "end_date": "2025-05-05",
      "timezone": "Asia/Shanghai",
      "type": "range",
      "year": 2025,
      "description": "放假共 5 天",
      "description_en": "5-day public holiday in mainland China",
      "url": "https://www.gov.cn/",
      "status": "completed",
      "last_verified": "2026-10-12",
      "verified_by": "auto",
      "makeup_workdays": [
        "2025-04-27"
      ]
    },
    {
      "id": "cn-holiday-2025-dragon-boat",
      "name": "端午节",
      "name_en": "2025 Dragon Boat Festival",
      "date": "2025-05-31",
      "end_date": "2025-06-02",
      "timezone": "Asia/Shanghai",
      "type": "range",
      "year": 2025,
      "description": "放假共 3 天",
      "description_en": "3-day public holiday in mainland China",
      "url": "https://www.gov.cn/",
      "status": "completed",
      "last_verified": "2026-10-12",
      "verified_by": "auto"
    },
    {
      "id": "cn-holiday-2025-国庆节、中秋节",
      "name": "国庆节、中秋节",
      "name_en": "2025 National Day & Mid-Autumn Festival",
      "date": "2025-10-01",
      "end_date": "2025-10-08",
      "timezone": "Asia/Shanghai",
      "type": "range",
      "year": 2025,
      "description": "放假共 8 天",
      "description_en": "8-day public holiday in mainland China",
      "url": "https://www.gov.cn/",
      "status": "completed",
      "last_verified": "2026-06-22",
      "verified_by": "auto",
      "makeup_workdays": [
        "2025-09-28",
        "2025-10-11"
      ]
    },
    {
      "id": "cn-holiday-2025-national-day-mid-autumn",
      "name": "国庆节、中秋节",
      "name_en": "2025 National Day & Mid-Autumn Festival",
      "date": "2025-10-01",
      "end_date": "2025-10-08",
      "timezone": "Asia/Shanghai",
      "type": "range",
      "year": 2025,
      "description": "放假共 8 天",
      "description_en": "8-day public holiday in mainland China",
      "url": "https://www.gov.cn/",
      "status": "completed",
      "last_verified": "2026-10-12",
      "verified_by": "auto",
      "makeup_workdays": [
        "2025-09-28",
        "2025-10-11"
      ]
    },
    {
      "id": "cn-holiday-2026-new-year",
      "name": "元旦",
      "name_en": "2026 New Year's Day",
      "date": "2026-01-01",
      "end_date": "2026-01-03",
      "timezone": "Asia/Shanghai",
      "type": "range",
      "year": 2026,
      "description": "放假共 3 天",
      "description_en": "3-day public holiday in mainland China",
      "url": "https://www.gov.cn/",
      "status": "completed",
      "last_verified": "2026-10-12",
      "verified_by": "auto",
      "makeup_workdays": [
        "2026-01-04"
      ]
    },
    {
      "id": "cn-holiday-2026-spring-festival",
      "name": "春节",
      "name_en": "2026 Spring Festival",
      "date": "2026-02-15",
      "end_date": "2026-02-23",
      "timezone": "Asia/Shanghai",
      "type": "range",
      "year": 2026,
      "description": "放假共 9 天",
      "description_en": "9-day public holiday in mainland China",
      "url": "https://www.gov.cn/",
      "status": "completed",
      "last_verified": "2026-10-12",
      "verified_by": "auto",
      "makeup_workdays": [
        "2026-02-14",
        "2026-02-28"
      ]
    },
    {
      "id": "cn-holiday-2026-qingming",
      "name": "清明节",
      "name_en": "2026 Qingming Festival",
      "date": "2026-04-04",
      "end_date": "2026-04-06",
      "timezone": "Asia/Shanghai",
      "type": "range",
      "year": 2026,
      "description": "放假共 3 天",
      "description_en": "3-day public holiday in mainland China",
      "url": "https://www.gov.cn/",
      "status": "completed",
      "last_verified": "2026-10-12",
      "verified_by": "auto"
    },
    {
      "id": "cn-holiday-2026-labor-day",
      "name": "劳动节",
      "name_en": "2026 Labour Day",
      "date": "2026-05-01",
      "end_date": "2026-05-05",
      "timezone": "Asia/Shanghai",
      "type": "range",
      "year": 2026,
      "description": "放假共 5 天",
      "description_en": "5-day public holiday in mainland China",
      "url": "https://www.gov.cn/",
      "status": "completed",
      "last_verified": "2026-10-12",
      "verified_by": "auto",
      "makeup_workdays": [
        "2026-05-09"
      ]
    },
    {
      "id": "cn-holiday-2026-dragon-boat",
      "name": "端午节",
      "name_en": "2026 Dragon Boat Festival",
      "date": "2026-06-19",
      "end_date": "2026-06-21",
      "timezone": "Asia/Shanghai",
      "type": "range",
      "year": 2026,
      "description": "放假共 3 天",
      "description_en": "3-day public holiday in mainland China",
      "url": "https://www.gov.cn/",
      "status": "completed",
      "last_verified": "2026-10-12",
      "verified_by": "auto"
    },
    {
      "id": "cn-holiday-2026-mid-autumn",
      "name": "中秋节",
      "name_en": "2026 Mid-Autumn Festival",
      "date": "2026-09-25",
      "end_date": "2026-09-27",
      "timezone": "Asia/Shanghai",
      "type": "range",
      "year": 2026,
      "description": "放假共 3 天",
      "description_en": "3-day public holiday in mainland China",
      "url": "https://www.gov.cn/",
      "status": "completed",
      "last_verified": "2026-10-12",
      "verified_by": "auto"
    },
    {
      "id": "cn-holiday-2026-national-day",
      "name": "国庆节",
      "name_en": "2026 National Day",
      "date": "2026-10-01",
      "end_date": "2026-10-07",
      "timezone": "Asia/Shanghai",
      "type": "range",
      "year": 2026,
      "description": "放假共 7 天",
      "description_en": "7-day public holiday in mainland China",
      "url": "https://www.gov.cn/",
      "status": "completed",
      "last_verified": "2026-10-12",
      "verified_by": "auto",
      "makeup_workdays": [
        "2026-09-20",
        "2026-10-10"
      ]
    }
  ],
  "subcategory_en": "Public Holidays"
}
